codelist_name,concept_id,concept_name,standard_concept
deep_vein_thrombosis,762015,Acute deep venous thrombosis of ileofemoral vein of left leg,S
deep_vein_thrombosis,765541,Acute deep venous thrombosis of ileofemoral vein of right lower extremity,S
deep_vein_thrombosis,44782748,Acute deep venous thrombosis of iliofemoral vein,S
deep_vein_thrombosis,44782752,Acute deep venous thrombosis of internal jugular vein,S
deep_vein_thrombosis,762009,Acute deep venous thrombosis of left axillary vein,S
deep_vein_thrombosis,760876,Acute deep venous thrombosis of left calf,S
deep_vein_thrombosis,765540,Acute deep venous thrombosis of left femoral vein,S
deep_vein_thrombosis,765922,Acute deep venous thrombosis of left internal jugular vein,S
deep_vein_thrombosis,762418,Acute deep venous thrombosis of left lower extremity,S
deep_vein_thrombosis,765537,Acute deep venous thrombosis of left upper extremity,S
deep_vein_thrombosis,762022,Acute deep venous thrombosis of politeal vein of right leg,S
deep_vein_thrombosis,44782743,Acute deep venous thrombosis of popliteal vein,S
deep_vein_thrombosis,762021,Acute deep venous thrombosis of popliteal vein of left leg,S
deep_vein_thrombosis,762010,Acute deep venous thrombosis of right axillary vein,S
deep_vein_thrombosis,760877,Acute deep venous thrombosis of right calf,S
deep_vein_thrombosis,762013,Acute deep venous thrombosis of right femoral vein,S
deep_vein_thrombosis,762018,Acute deep venous thrombosis of right internal jugular vein,S
deep_vein_thrombosis,762419,Acute deep venous thrombosis of right lower extremity,S
deep_vein_thrombosis,762005,Acute deep venous thrombosis of right upper extremity,S
deep_vein_thrombosis,44782745,Acute deep venous thrombosis of thigh,S
deep_vein_thrombosis,44782744,Acute deep venous thrombosis of tibial vein,S
deep_vein_thrombosis,762026,Acute deep venous thrombosis of tibial vein of left leg,S
deep_vein_thrombosis,765156,Acute deep venous thrombosis of tibial vein of right leg,S
deep_vein_thrombosis,44782421,Acute deep venous thrombosis of upper extremity,S
deep_vein_thrombosis,762048,Acute thrombosis of left subclavian vein,S
deep_vein_thrombosis,45757410,Acute thrombosis of mesenteric vein,S
deep_vein_thrombosis,762049,Acute thrombosis of right subclavian vein,S
deep_vein_thrombosis,36712892,Acute thrombosis of splenic vein,S
deep_vein_thrombosis,4179911,Axillary vein thrombosis,S
deep_vein_thrombosis,44782762,Acute thrombosis of subclavian vein,S
deep_vein_thrombosis,37109253,Bilateral acute deep vein thrombosis of femoral veins,S
deep_vein_thrombosis,40478951,Bilateral deep vein thrombosis of lower extremities,S
deep_vein_thrombosis,4042396,Deep thrombophlebitis,S
deep_vein_thrombosis,77310,Deep vein phlebitis and thrombophlebitis of the leg,NA
deep_vein_thrombosis,4189004,Deep vein thrombosis of leg related to intravenous drug use,NA
deep_vein_thrombosis,3655221,Deep vein thrombosis of lower extremity due to intravenous drug use,S
deep_vein_thrombosis,4133004,Deep venous thrombosis,S
deep_vein_thrombosis,45773536,Deep venous thrombosis of femoropopliteal vein,S
deep_vein_thrombosis,763942,Deep venous thrombosis of left lower extremity,S
deep_vein_thrombosis,761980,Deep venous thrombosis of left upper extremity,S
deep_vein_thrombosis,443537,Deep venous thrombosis of lower extremity,S
deep_vein_thrombosis,4133975,Deep venous thrombosis of pelvic vein,S
deep_vein_thrombosis,40480555,Deep venous thrombosis of peroneal vein,S
deep_vein_thrombosis,4322565,Deep venous thrombosis of profunda femoris vein,S
deep_vein_thrombosis,763941,Deep venous thrombosis of right lower extremity,S
deep_vein_thrombosis,761928,Deep venous thrombosis of right upper extremity,S
deep_vein_thrombosis,4207899,Deep venous thrombosis of tibial vein,S
deep_vein_thrombosis,4028057,Deep venous thrombosis of upper extremity,S
deep_vein_thrombosis,435565,Embolism and thrombosis of the vena cava,S
deep_vein_thrombosis,40481089,Embolism from thrombosis of vein of lower extremity,S
deep_vein_thrombosis,4119760,Iliofemoral deep vein thrombosis,S
deep_vein_thrombosis,4124856,Inferior mesenteric vein thrombosis,S
deep_vein_thrombosis,4096099,Phlebitis of deep veins of lower extremity,S
deep_vein_thrombosis,4281689,Phlegmasia alba dolens,S
deep_vein_thrombosis,4284538,Phlegmasia cerulea dolens,S
deep_vein_thrombosis,46285905,Provoked deep vein thrombosis,S
deep_vein_thrombosis,46271900,Recurrent deep vein thrombosis,S
deep_vein_thrombosis,4033521,Splenic vein thrombosis,S
deep_vein_thrombosis,4055089,Superior mesenteric vein thrombosis,S
deep_vein_thrombosis,4230403,Thrombophlebitis of axillary vein,S
deep_vein_thrombosis,4069561,Thrombophlebitis of deep femoral vein,S
deep_vein_thrombosis,761831,Thrombophlebitis of deep vein of bilateral lower limbs,S
deep_vein_thrombosis,761830,Thrombophlebitis of deep vein of left lower limb,S
deep_vein_thrombosis,761808,Thrombophlebitis of deep vein of left upper limb,S
deep_vein_thrombosis,761832,Thrombophlebitis of deep vein of right lower limb,S
deep_vein_thrombosis,761809,Thrombophlebitis of deep vein of right upper limb,S
deep_vein_thrombosis,4221821,Thrombophlebitis of deep veins of lower extremity,S
deep_vein_thrombosis,440750,Thrombophlebitis of deep veins of upper extremities,S
deep_vein_thrombosis,4176614,Thrombophlebitis of iliac vein,S
deep_vein_thrombosis,761821,Thrombophlebitis of left deep femoral vein,S
deep_vein_thrombosis,761819,Thrombophlebitis of left femoral vein,S
deep_vein_thrombosis,761820,Thrombophlebitis of right deep femoral vein,S
deep_vein_thrombosis,761818,Thrombophlebitis of right femoral vein,S
deep_vein_thrombosis,4110339,Thrombophlebitis of the anterior tibial vein,S
deep_vein_thrombosis,4111868,Thrombophlebitis of the common iliac vein,S
deep_vein_thrombosis,4110343,Thrombophlebitis of the external iliac vein,S
deep_vein_thrombosis,439314,Thrombophlebitis of the femoral vein,S
deep_vein_thrombosis,4109877,Thrombophlebitis of the internal iliac vein,S
deep_vein_thrombosis,4112171,Thrombophlebitis of the popliteal vein,S
deep_vein_thrombosis,4112172,Thrombophlebitis of the posterior tibial vein,S
deep_vein_thrombosis,4250765,Thrombophlebitis of tibial vein,S
deep_vein_thrombosis,42538533,Thrombosis of iliac vein,S
deep_vein_thrombosis,44811347,Thrombosis of internal jugular vein,S
deep_vein_thrombosis,765049,Thrombosis of left peroneal vein,S
deep_vein_thrombosis,4317289,Thrombosis of mesenteric vein,S
deep_vein_thrombosis,4203836,Thrombosis of subclavian vein,S
deep_vein_thrombosis,4175649,Thrombosis of the popliteal vein,S
deep_vein_thrombosis,4149782,Thrombosis of vein of lower limb,S
deep_vein_thrombosis,4153353,Traumatic thrombosis of axillary vein,S
deep_vein_thrombosis,46285904,Unprovoked deep vein thrombosis,S
deep_vein_thrombosis,199837,Portal vein thrombosis,S
deep_vein_thrombosis,193512,Embolism and thrombosis of the renal vein,S
deep_vein_thrombosis,4111861,Phlebitis of popliteal vein,S
deep_vein_thrombosis,440738,Phlebitis of the femoral vein,S
deep_vein_thrombosis,435887,Antepartum deep vein thrombosis,S
deep_vein_thrombosis,438820,Deep venous thrombosis in puerperium,S
anaphylaxis,37207726,Anaphylaxis due to allergen immunotherapy,NA
anaphylaxis,42539054,Shock co-occurrent and due to anaphylaxis caused by serum,S
anaphylaxis,441202,Anaphylaxis,S
anaphylaxis,4083867,Human protein-induced anaphylaxis,NA
anaphylaxis,4084639,Idiopathic anaphylaxis,S
anaphylaxis,42536383,Anaphylactic shock,S
anaphylaxis,442038,Anaphylactic shock due to serum,S
anaphylaxis,4193788,Anaphylactic transfusion reaction,S
anaphylaxis,4302371,"Anaphylactic shock, due to adverse effect of correct medicinal substance properly administered",NA
anaphylaxis,762509,Anaphylaxis due to human papillomavirus vaccine,S
anaphylaxis,762511,Anaphylaxis due to diphtheria and tetanus vaccine,S
anaphylaxis,762512,"Anaphylaxis due to tetanus, diphtheria and acellular pertussis vaccine",S
anaphylaxis,762513,Anaphylaxis due to meningococcal vaccine,S
anaphylaxis,762514,Anaphylaxis due to Hepatitis B vaccine,S
anaphylaxis,762515,Anaphylaxis due to rotavirus vaccine,S
anaphylaxis,762909,Anaphylaxis due to Hemophilus influenzae type b vaccine,NA
anaphylaxis,4084168,Drug-induced anaphylaxis,S
anaphylaxis,4084169,Penicillin-induced anaphylaxis,S
anaphylaxis,4086737,Insulin-induced anaphylaxis,S
anaphylaxis,4302371,"Anaphylactic shock, due to adverse effect of correct medicinal substance properly administered",NA
myocarditis_or_pericarditis,312653,Acute myocarditis,S
myocarditis_or_pericarditis,4147350,Acute myoendocarditis,S
myocarditis_or_pericarditis,4006483,Acute myopericarditis,S
myocarditis_or_pericarditis,317307,Idiopathic myocarditis,S
myocarditis_or_pericarditis,43020652,Inflammatory cardiomyopathy,S
myocarditis_or_pericarditis,4242712,Interstitial myocarditis,S
myocarditis_or_pericarditis,314383,Myocarditis,S
myocarditis_or_pericarditis,4219260,Myocarditis due to drug,S
myocarditis_or_pericarditis,4336533,Myocarditis due to hypersensitivity state,S
myocarditis_or_pericarditis,37109914,Myopericarditis,S
myocarditis_or_pericarditis,4143969,Isolated (Fiedler's) myocarditis,S
myocarditis_or_pericarditis,4071283,Acute benign pericarditis,S
myocarditis_or_pericarditis,4072086,Acute bloody pericarditis,S
myocarditis_or_pericarditis,4070323,Acute effusive pericarditis,S
myocarditis_or_pericarditis,315293,Acute idiopathic pericarditis,S
myocarditis_or_pericarditis,4304392,Acute mediastinopericarditis,S
myocarditis_or_pericarditis,4006483,Acute myopericarditis,S
myocarditis_or_pericarditis,320116,Acute pericarditis,S
myocarditis_or_pericarditis,4204985,Acute periendocarditis,S
myocarditis_or_pericarditis,4069712,Acute pleuropericarditis,S
myocarditis_or_pericarditis,4178425,Acute pneumopericarditis,S
myocarditis_or_pericarditis,44782774,Chest pain due to pericarditis,S
myocarditis_or_pericarditis,4031469,Drug-induced pericarditis,S
myocarditis_or_pericarditis,4218568,Non-infectious pericarditis,S
myocarditis_or_pericarditis,4138837,Pericarditis,S
myocarditis_or_pericarditis,4245386,Pericarditis sicca,S
myocarditis_or_pericarditis,312928,adhesive pericarditis,S
myocarditis_or_pericarditis,312334,constrictive pericarditis,S
myocarditis_or_pericarditis,4238032,Acute pericardial effusion,S
myocarditis_or_pericarditis,4108814,Pericardial effusion - noninflammatory,S
myocarditis_or_pericarditis,4203625,Chronic constrictive pericarditis,S
myocarditis_or_pericarditis,4121477,Post-infarction pericarditis,S
thrombosis,45766075,Acute anterior ST segment elevation myocardial infarction,S
thrombosis,4178129,Acute anteroapical myocardial infarction,S
thrombosis,4267568,Acute anteroseptal myocardial infarction,S
thrombosis,762047,Acute bilateral thrombosis of subclavian veins,S
thrombosis,762148,Acute deep vein thrombosis of bilateral iliac veins,S
thrombosis,761444,Acute deep vein thrombosis of bilateral lower limbs following coronary artery bypass graft,S
thrombosis,35616028,Acute deep vein thrombosis of left iliac vein,S
thrombosis,35615035,Acute deep vein thrombosis of left lower limb following procedure,S
thrombosis,761416,Acute deep vein thrombosis of left upper limb following coronary artery bypass graft,S
thrombosis,35615031,Acute deep vein thrombosis of left upper limb following procedure,S
thrombosis,43531681,Acute deep vein thrombosis of lower limb,S
thrombosis,35616027,Acute deep vein thrombosis of right iliac vein,S
thrombosis,35615034,Acute deep vein thrombosis of right lower limb following procedure,S
thrombosis,761415,Acute deep vein thrombosis of right upper limb following coronary artery bypass graft,S
thrombosis,35615030,Acute deep vein thrombosis of right upper limb following procedure,S
thrombosis,44782746,Acute deep venous thrombosis,S
thrombosis,44782751,Acute deep venous thrombosis of axillary vein,S
thrombosis,762008,Acute deep venous thrombosis of bilateral axillary veins,S
thrombosis,760875,Acute deep venous thrombosis of bilateral calves,S
thrombosis,765155,Acute deep venous thrombosis of bilateral ileofemoral veins,S
thrombosis,762017,Acute deep venous thrombosis of bilateral internal jugular veins,S
thrombosis,762417,Acute deep venous thrombosis of bilateral legs,S
thrombosis,762020,Acute deep venous thrombosis of bilateral popliteal veins,S
thrombosis,765546,Acute deep venous thrombosis of bilateral tibial veins,S
thrombosis,762004,Acute deep venous thrombosis of both upper extremities,S
thrombosis,44782742,Acute deep venous thrombosis of calf,S
thrombosis,44782747,Acute deep venous thrombosis of femoral vein,S
thrombosis,762015,Acute deep venous thrombosis of ileofemoral vein of left leg,S
thrombosis,765541,Acute deep venous thrombosis of ileofemoral vein of right lower extremity,S
thrombosis,44782748,Acute deep venous thrombosis of iliofemoral vein,S
thrombosis,44782752,Acute deep venous thrombosis of internal jugular vein,S
thrombosis,762009,Acute deep venous thrombosis of left axillary vein,S
thrombosis,760876,Acute deep venous thrombosis of left calf,S
thrombosis,765540,Acute deep venous thrombosis of left femoral vein,S
thrombosis,765922,Acute deep venous thrombosis of left internal jugular vein,S
thrombosis,762418,Acute deep venous thrombosis of left lower extremity,S
thrombosis,765537,Acute deep venous thrombosis of left upper extremity,S
thrombosis,44782767,Acute deep venous thrombosis of lower extremity as complication of procedure,S
thrombosis,46270071,Acute deep venous thrombosis of lower limb due to and following coronary artery bypass grafting,S
thrombosis,762022,Acute deep venous thrombosis of politeal vein of right leg,S
thrombosis,44782743,Acute deep venous thrombosis of popliteal vein,S
thrombosis,762021,Acute deep venous thrombosis of popliteal vein of left leg,S
thrombosis,762010,Acute deep venous thrombosis of right axillary vein,S
thrombosis,760877,Acute deep venous thrombosis of right calf,S
thrombosis,762013,Acute deep venous thrombosis of right femoral vein,S
thrombosis,762018,Acute deep venous thrombosis of right internal jugular vein,S
thrombosis,762419,Acute deep venous thrombosis of right lower extremity,S
thrombosis,762005,Acute deep venous thrombosis of right upper extremity,S
thrombosis,44782745,Acute deep venous thrombosis of thigh,S
thrombosis,44782744,Acute deep venous thrombosis of tibial vein,S
thrombosis,762026,Acute deep venous thrombosis of tibial vein of left leg,S
thrombosis,765156,Acute deep venous thrombosis of tibial vein of right leg,S
thrombosis,44782421,Acute deep venous thrombosis of upper extremity,S
thrombosis,764016,Acute deep venous thrombosis of upper extremity after coronary artery bypass graft,S
thrombosis,44782766,Acute deep venous thrombosis of upper extremity as complication of procedure,S
thrombosis,4120091,Acute massive pulmonary embolism,S
thrombosis,312327,Acute myocardial infarction,S
thrombosis,44782769,Acute myocardial infarction due to left coronary artery occlusion,S
thrombosis,44782712,Acute myocardial infarction due to right coronary artery occlusion,S
thrombosis,45766115,Acute myocardial infarction during procedure,S
thrombosis,434376,Acute myocardial infarction of anterior wall,S
thrombosis,45766150,Acute myocardial infarction of anterior wall involving right ventricle,S
thrombosis,438438,Acute myocardial infarction of anterolateral wall,S
thrombosis,4243372,Acute myocardial infarction of apical-lateral wall,S
thrombosis,4108669,Acute myocardial infarction of atrium,S
thrombosis,4151046,Acute myocardial infarction of basal-lateral wall,S
thrombosis,4275436,Acute myocardial infarction of high lateral wall,S
thrombosis,438170,Acute myocardial infarction of inferior wall,S
thrombosis,45771322,Acute myocardial infarction of inferior wall involving right ventricle,S
thrombosis,438447,Acute myocardial infarction of inferolateral wall,S
thrombosis,441579,Acute myocardial infarction of inferoposterior wall,S
thrombosis,436706,Acute myocardial infarction of lateral wall,S
thrombosis,4324413,Acute myocardial infarction of posterobasal wall,S
thrombosis,4051874,Acute myocardial infarction of posterolateral wall,S
thrombosis,4303359,Acute myocardial infarction of septum,S
thrombosis,4145721,Acute non-Q wave infarction,S
thrombosis,4119944,Acute non-Q wave infarction - anterolateral,S
thrombosis,4119456,Acute non-Q wave infarction - anteroseptal,S
thrombosis,4119945,Acute non-Q wave infarction - inferior,S
thrombosis,4119946,Acute non-Q wave infarction - inferolateral,S
thrombosis,4121466,Acute non-Q wave infarction - lateral,S
thrombosis,4124685,Acute non-Q wave infarction - widespread,S
thrombosis,4270024,Acute non-ST segment elevation myocardial infarction,S
thrombosis,35610091,Acute nontransmural myocardial infarction,S
thrombosis,319039,Acute posterior myocardial infarction,S
thrombosis,45768439,Acute pulmonary embolism,S
thrombosis,45768888,Acute pulmonary thromboembolism,S
thrombosis,4119457,Acute Q wave infarction - anterolateral,S
thrombosis,4119943,Acute Q wave infarction - anteroseptal,S
thrombosis,4121464,Acute Q wave infarction - inferior,S
thrombosis,4121465,Acute Q wave infarction - inferolateral,S
thrombosis,4124684,Acute Q wave infarction - lateral,S
thrombosis,4119948,Acute Q wave infarction - widespread,S
thrombosis,4126801,Acute Q wave myocardial infarction,S
thrombosis,4296653,Acute ST segment elevation myocardial infarction,S
thrombosis,46270162,Acute ST segment elevation myocardial infarction due to left coronary artery occlusion,S
thrombosis,46270163,Acute ST segment elevation myocardial infarction due to right coronary artery occlusion,S
thrombosis,43020460,Acute ST segment elevation myocardial infarction involving left anterior descending coronary artery,S
thrombosis,45766076,Acute ST segment elevation myocardial infarction of anterior wall involving right ventricle,S
thrombosis,761736,Acute ST segment elevation myocardial infarction of anteroapical wall,S
thrombosis,46270159,Acute ST segment elevation myocardial infarction of anterolateral wall,S
thrombosis,46270160,Acute ST segment elevation myocardial infarction of anteroseptal wall,S
thrombosis,45766116,Acute ST segment elevation myocardial infarction of inferior wall,S
thrombosis,45766151,Acute ST segment elevation myocardial infarction of inferior wall involving right ventricle,S
thrombosis,35611570,Acute ST segment elevation myocardial infarction of inferolateral wall,S
thrombosis,35611571,Acute ST segment elevation myocardial infarction of inferoposterior wall,S
thrombosis,46274044,Acute ST segment elevation myocardial infarction of lateral wall,S
thrombosis,46270161,Acute ST segment elevation myocardial infarction of posterior wall,S
thrombosis,46273495,Acute ST segment elevation myocardial infarction of posterobasal wall,S
thrombosis,46270158,Acute ST segment elevation myocardial infarction of posterolateral wall,S
thrombosis,46270164,Acute ST segment elevation myocardial infarction of septum,S
thrombosis,444406,Acute subendocardial infarction,S
thrombosis,762048,Acute thrombosis of left subclavian vein,S
thrombosis,45757410,Acute thrombosis of mesenteric vein,S
thrombosis,762049,Acute thrombosis of right subclavian vein,S
thrombosis,36712892,Acute thrombosis of splenic vein,S
thrombosis,44782762,Acute thrombosis of subclavian vein,S
thrombosis,35610093,Acute transmural myocardial infarction,S
thrombosis,4119947,Acute widespread myocardial infarction,S
thrombosis,4048784,Anterior cerebral circulation hemorrhagic infarction,S
thrombosis,4045735,Anterior cerebral circulation infarction,S
thrombosis,4031045,Anterior choroidal artery syndrome,S
thrombosis,37109912,Arrhythmia due to and following acute myocardial infarction,S
thrombosis,438172,Atrial septal defect due to and following acute myocardial infarction,S
thrombosis,37109253,Bilateral acute deep vein thrombosis of femoral veins,S
thrombosis,761110,Bilateral cerebral infarction due to precererbral arterial occlusion,S
thrombosis,40478951,Bilateral deep vein thrombosis of lower extremities,S
thrombosis,196715,Budd-Chiari syndrome,S
thrombosis,4124687,Cardiac rupture due to and following acute myocardial infarction,S
thrombosis,372924,Cerebral artery occlusion,S
thrombosis,4110189,Cerebral infarct due to thrombosis of precerebral arteries,S
thrombosis,443454,Cerebral infarction,S
thrombosis,762951,Cerebral infarction due to anterior cerebral artery occlusion,S
thrombosis,765515,Cerebral infarction due to basilar artery stenosis,S
thrombosis,43530683,Cerebral infarction due to carotid artery occlusion,S
thrombosis,762933,Cerebral infarction due to cerebral artery occlusion,S
thrombosis,762937,Cerebral infarction due to cerebral venous thrombosis,S
thrombosis,4111714,"Cerebral infarction due to cerebral venous thrombosis, non-pyogenic",S
thrombosis,4108356,Cerebral infarction due to embolism of cerebral arteries,S
thrombosis,45772786,Cerebral infarction due to embolism of middle cerebral artery,S
thrombosis,4110190,Cerebral infarction due to embolism of precerebral arteries,S
thrombosis,762935,Cerebral infarction due to internal carotid artery occlusion,S
thrombosis,763015,Cerebral infarction due to middle cerebral artery occlusion,S
thrombosis,46273649,Cerebral infarction due to occlusion of basilar artery,S
thrombosis,35610084,Cerebral infarction due to occlusion of cerebral artery,S
thrombosis,46270031,Cerebral infarction due to occlusion of precerebral artery,S
thrombosis,762934,Cerebral infarction due to posterior cerebral artery occlusion,S
thrombosis,43531607,Cerebral infarction due to stenosis of carotid artery,S
thrombosis,35610085,Cerebral infarction due to stenosis of cerebral artery,S
thrombosis,46270381,Cerebral infarction due to stenosis of precerebral artery,S
thrombosis,4110192,Cerebral infarction due to thrombosis of cerebral arteries,S
thrombosis,45767658,Cerebral infarction due to thrombosis of middle cerebral artery,S
thrombosis,44782773,Cerebral infarction due to vertebral artery occlusion,S
thrombosis,46270380,Cerebral infarction due to vertebral artery stenosis,S
thrombosis,37110678,Cerebral ischemic stroke due to occlusion of extracranial large artery,S
thrombosis,37110679,Cerebral ischemic stroke due to stenosis of extracranial large artery,S
thrombosis,4102202,Cerebral venous sinus thrombosis,S
thrombosis,4046443,Cerebral venous thrombosis of cortical vein,S
thrombosis,762938,Cerebral venous thrombosis of cortical vein with infarction,S
thrombosis,762811,Cerebral venous thrombosis of cortical vein without infarction,S
thrombosis,4048787,Cerebral venous thrombosis of great cerebral vein,S
thrombosis,4048786,Cerebral venous thrombosis of sigmoid sinus,S
thrombosis,4043735,Cerebral venous thrombosis of straight sinus,S
thrombosis,45757409,Chronic thrombosis of mesenteric vein,S
thrombosis,36712891,Chronic thrombosis of splenic vein,S
thrombosis,4042396,Deep thrombophlebitis,S
thrombosis,4046884,Deep vein thrombosis of leg related to air travel,S
thrombosis,4133004,Deep venous thrombosis,S
thrombosis,4181315,Deep venous thrombosis associated with coronary artery bypass graft,S
thrombosis,45773536,Deep venous thrombosis of femoropopliteal vein,S
thrombosis,763942,Deep venous thrombosis of left lower extremity,S
thrombosis,761980,Deep venous thrombosis of left upper extremity,S
thrombosis,443537,Deep venous thrombosis of lower extremity,S
thrombosis,4133975,Deep venous thrombosis of pelvic vein,S
thrombosis,40480555,Deep venous thrombosis of peroneal vein,S
thrombosis,4322565,Deep venous thrombosis of profunda femoris vein,S
thrombosis,763941,Deep venous thrombosis of right lower extremity,S
thrombosis,761928,Deep venous thrombosis of right upper extremity,S
thrombosis,4207899,Deep venous thrombosis of tibial vein,S
thrombosis,4028057,Deep venous thrombosis of upper extremity,S
thrombosis,435565,Embolism and thrombosis of the vena cava,S
thrombosis,40481089,Embolism from thrombosis of vein of lower extremity,S
thrombosis,4215259,First myocardial infarction,S
thrombosis,4108678,Hemopericardium due to and following acute myocardial infarction,S
thrombosis,4046362,Hemorrhagic cerebral infarction,S
thrombosis,4309039,Hemorrhagic pulmonary infarction,S
thrombosis,4119760,Iliofemoral deep vein thrombosis,S
thrombosis,4131383,Infarction of basal ganglia,S
thrombosis,762808,Infarction of lung due to embolus,S
thrombosis,40480461,Infarction of lung due to iatrogenic pulmonary embolism,S
thrombosis,4046237,Infarction of optic radiation,S
thrombosis,4119140,Infarction of visual cortex,S
thrombosis,4043731,Infarction - precerebral,S
thrombosis,4124856,Inferior mesenteric vein thrombosis,S
thrombosis,4120316,Intracranial septic thrombophlebitis,S
thrombosis,4194609,Intracranial thrombophlebitis,S
thrombosis,4141405,Left sided cerebral infarction,S
thrombosis,4173167,Mesenteric embolus,S
thrombosis,4173632,Microinfarct of heart,S
thrombosis,45766214,Mitral valve regurgitation due to acute myocardial infarction without papillary muscle and chordal rupture,S
thrombosis,45771327,Mitral valve regurgitation due to acute myocardial infarction with papillary muscle and chordal rupture,S
thrombosis,4323202,Mixed myocardial ischemia and infarction,S
thrombosis,37116473,Multifocal cerebral infarction due to and following procedure on cardiovascular system,S
thrombosis,4329847,Myocardial infarction,S
thrombosis,4170094,Myocardial infarction in recovery phase,S
thrombosis,314667,Nonpyogenic thrombosis of intracranial venous sinus,S
thrombosis,4111713,Non-pyogenic venous sinus thrombosis,S
thrombosis,4200113,Non-Q wave myocardial infarction,S
thrombosis,4077086,Occipital cerebral infarction,S
thrombosis,764503,Occlusion of cerebral vein by nonpyogenic thrombus,S
thrombosis,4046359,Partial anterior cerebral circulation infarction,S
thrombosis,4096099,Phlebitis of deep veins of lower extremity,S
thrombosis,4281689,Phlegmasia alba dolens,S
thrombosis,4284538,Phlegmasia cerulea dolens,S
thrombosis,4319146,Pituitary infarction,S
